SQL> create table employee(
  2  ssn number primary key,
  3  name varchar(20) not null,
  4  deptno number not null
  5  );

Table created.

SQL> create table project(
  2  projectno number primary key,
  3  projectarea varchar(20) not null
  4  );

Table created.

SQL> create table assigned_to(
  2  usn number references employee(ssn) on delete cascade,
  3  projectno references project(projectno) on delete cascade,
  4  primary key(usn, projectno)
  5  );

Table created.

SQL> desc employee
 Name                                      Null?    Type
 ----------------------------------------- -------- ----------------------------
 SSN                                       NOT NULL NUMBER
 NAME                                      NOT NULL VARCHAR2(20)
 DEPTNO                                    NOT NULL NUMBER

SQL> desc project
 Name                                      Null?    Type
 ----------------------------------------- -------- ----------------------------
 PROJECTNO                                 NOT NULL NUMBER
 PROJECTAREA                               NOT NULL VARCHAR2(20)

SQL> desc assigned_to
 Name                                      Null?    Type
 ----------------------------------------- -------- ----------------------------
 USN                                       NOT NULL NUMBER
 PROJECTNO                                 NOT NULL NUMBER

SQL> insert into employee values(&SSN, '&Name', &DeptNo);
Enter value for ssn: 100
Enter value for name: Anurag
Enter value for deptno: 10
old   1: insert into employee values(&SSN, '&Name', &DeptNo)
new   1: insert into employee values(100, 'Anurag', 10)

1 row created.

SQL> /
Enter value for ssn: 101
Enter value for name: Harsh
Enter value for deptno: 20
old   1: insert into employee values(&SSN, '&Name', &DeptNo)
new   1: insert into employee values(101, 'Harsh', 20)

1 row created.

SQL> /
Enter value for ssn: 102
Enter value for name: Josh
Enter value for deptno: 20
old   1: insert into employee values(&SSN, '&Name', &DeptNo)
new   1: insert into employee values(102, 'Josh', 20)

1 row created.

SQL> insert into employee values(&SSN, '&Name', &DeptNo);
Enter value for ssn: 103
Enter value for name: Rohan
Enter value for deptno: 30
old   1: insert into employee values(&SSN, '&Name', &DeptNo)
new   1: insert into employee values(103, 'Rohan', 30)

1 row created.

SQL> select * from employee;

       SSN NAME                     DEPTNO
---------- -------------------- ----------
       100 Anurag                       10
       101 Harsh                        20
       102 Josh                         20
       103 Rohan                        30

SQL> insert into project values(&ProjectNo, '&projectArea');
Enter value for projectno: 10
Enter value for projectarea: Bhilai
old   1: insert into project values(&ProjectNo, '&projectArea')
new   1: insert into project values(10, 'Bhilai')

1 row created.

SQL> /
Enter value for projectno: 20
Enter value for projectarea: Durg
old   1: insert into project values(&ProjectNo, '&projectArea')
new   1: insert into project values(20, 'Durg')

1 row created.

SQL> /
Enter value for projectno: 30
Enter value for projectarea: Raipur
old   1: insert into project values(&ProjectNo, '&projectArea')
new   1: insert into project values(30, 'Raipur')

1 row created.

SQL> select * from project;

 PROJECTNO PROJECTAREA
---------- --------------------
        10 Bhilai
        20 Durg
        30 Raipur

SQL> insert into assigned_to values(&usn, &projectno);
Enter value for usn: 100
Enter value for projectno: 10
old   1: insert into assigned_to values(&usn, &projectno)
new   1: insert into assigned_to values(100, 10)

1 row created.

SQL> /
Enter value for usn: 101
Enter value for projectno: 20
old   1: insert into assigned_to values(&usn, &projectno)
new   1: insert into assigned_to values(101, 20)

1 row created.

SQL> /
Enter value for usn: 101
Enter value for projectno: 30
old   1: insert into assigned_to values(&usn, &projectno)
new   1: insert into assigned_to values(101, 30)

1 row created.

SQL> /
Enter value for usn: 102
Enter value for projectno: 20
old   1: insert into assigned_to values(&usn, &projectno)
new   1: insert into assigned_to values(102, 20)

1 row created.

SQL> /
Enter value for usn: 103
Enter value for projectno: 20
old   1: insert into assigned_to values(&usn, &projectno)
new   1: insert into assigned_to values(103, 20)

1 row created.

SQL> /
Enter value for usn: 103
Enter value for projectno: 30
old   1: insert into assigned_to values(&usn, &projectno)
new   1: insert into assigned_to values(103, 30)

1 row created.

SQL> select * from assigned_to;

       USN  PROJECTNO
---------- ----------
       100         10
       101         20
       101         30
       102         20
       103         20
       103         30

6 rows selected.

SQL> select usn from assigned_to
  2  where projectno=10;

       USN
----------
       100

SQL> select deptno, count(*)
  2  from employee
  3  group by deptno
  4  order by deptno;

    DEPTNO   COUNT(*)
---------- ----------
        10          1
        20          2
        30          1

SQL> update assigned_to
  2  set projectno=20
  3  where usn=100;

1 row updated.

SQL> select * from assigned_to;

       USN  PROJECTNO
---------- ----------
       100         20
       101         20
       101         30
       102         20
       103         20
       103         30

6 rows selected.
